{
  "schema_version":"0.1.0",
  "contract_id":"PFC-EXAMPLE-CRM-001",
  "status":"DRAFT",
  "project_identity":{"project_id":"example-crm","name":"Example Clinical CRM","canonical_repository":"owner/example-crm","canonical_branch":"main","risk_tier":"CRITICAL"},
  "product_intent":{"problem":"Coordinate clinical operations without cross-tenant data exposure.","target_users":["clinical_staff","administrators"],"value_proposition":"A secure and auditable workflow for patient and appointment operations.","success_definition":["Core flow completes end to end","No cross-tenant access","Synthetic test state is removed"]},
  "users_and_core_flows":[{"flow_id":"CREATE_APPOINTMENT","actor":"clinical_staff","preconditions":["authenticated","patient_exists","slot_available"],"action":"Create an appointment","expected_effects":["appointment persisted","availability updated","audit event created"],"forbidden_effects":["double booking","cross-tenant mutation","real notification during test"]}],
  "scope_and_non_goals":{"in_scope":["patient lookup","appointment creation","audit trail"],"out_of_scope":["billing","production messaging"],"non_goals":["replace clinical judgment"]},
  "rules":[{"rule_id":"INV-TENANT-001","class":"INVARIANT","statement":"Data from one tenant must never be readable or mutable by another tenant.","severity":"CRITICAL","verification_required":true,"required_evidence":["cross_tenant_negative_test","authorization_trace"],"source_refs":["LAB_CONTRACT.md"],"failure_effect":"BLOCK_RELEASE"},{"rule_id":"PAT-STATE-001","class":"RECOMMENDED_PATTERN","statement":"Distinguish configured, effective and behavior-verified states.","severity":"HIGH","verification_required":true,"required_evidence":["configuration_record","effective_runtime_check","end_to_end_result"],"source_refs":["projects/lab/evidence/EVD-LAB-PL003-PROPAGATION-AWARE-ATOMIC-SIMULATION-RETRY-127-ATTEMPT-001.json"],"failure_effect":"BLOCK_PHASE"}],
  "quality_baseline":{"visual":"contextual minimum impeccable baseline","accessibility":"keyboard and zoom/reflow checks","maintainability":"bounded modules and explicit ownership"},
  "architecture_boundaries":{"system_boundaries":["browser","api","domain","persistence"],"data_ownership":["project repository owns runtime schemas"],"security_boundaries":["server-side authorization","secrets outside client"],"observability_requirements":["request correlation","audit event","error metrics"],"three_state_verification":{"configured":"Artifact or configuration is stored.","effective":"The relevant runtime can consume it.","behavior_verified":"Observed behavior satisfies the expected outcome."}},
  "failure_modes":[{"failure_id":"FM-TENANT-LEAK","description":"Authorization scope fails and exposes another tenant.","impact":"Critical privacy breach","detection":["negative integration test","audit review"],"mitigation":["centralized authorization","tenant-scoped queries","release gate"]}],
  "validation_and_evidence":{"required_gates":["context","product","architecture","implementation","real_system_validation","rollback"],"acceptance_evidence":["test report","trace","final state reconciliation"],"result_classes":["PASS","BLOCKED_INVARIANT_FAILURE","BLOCKED_ROLLBACK_NOT_VERIFIED"]},
  "rollback_and_recovery":{"baseline_required":true,"rollback_required":true,"final_state_reconciliation_required":true,"recovery_requirements":["remove synthetic records","verify queues","compare final baseline"]},
  "authority_and_stop_conditions":{"authority_effect":"NONE","execution_authorized":false,"stop_conditions":["missing authority","critical invariant unresolved","rollback unavailable"]}
}
